{
  "$schema": "../../hub/schema/tool.schema.json",
  "id": "github-logout",
  "name": "Đăng xuất GitHub trên máy",
  "version": "1.0",
  "category": "tien-ich",
  "icon": "key",
  "audience": "tech",
  "summary": "Xoá thông tin đăng nhập GitHub mà Git lưu trong Windows để lần git push sau chọn lại tài khoản. Không xoá code, commit hay repo.",
  "tags": ["github", "git", "đăng xuất", "credential", "tài khoản"],
  "actions": [
    {
      "id": "dang-xuat",
      "label": "Xoá đăng nhập GitHub đã lưu",
      "file": "logout-github-local.bat",
      "type": "console",
      "admin": false,
      "risk": "modifies-system",
      "primary": true,
      "duration": "Vài giây",
      "description": "Liệt kê rồi xoá các mục GitHub trong Windows Credential Manager của tài khoản đang đăng nhập; có GitHub CLI thì hỏi trước khi đăng xuất gh.",
      "confirm": "Lần git push sau sẽ phải đăng nhập GitHub lại. Công cụ chạy cho đúng tài khoản Windows hiện tại nên không được chạy bằng quyền Admin.",
      "changes": [
        "Xoá các mục git:https://github.com, github.com trong Credential Manager",
        "Hỏi trước rồi mới chạy 'gh auth logout' nếu máy có GitHub CLI"
      ]
    }
  ],
  "issues": [
    "Chỉ xoá 4 tên mục cố định; nếu Git Credential Manager lưu riêng theo từng tài khoản (tên mục có kèm tên người dùng) thì có thể sót.",
    "Luôn in 'Đã chạy lệnh xoá' kể cả khi không có mục nào để xoá."
  ],
  "upgrades": [
    "P1: Lọc 'cmdkey /list' theo 'github' để xoá đúng mọi mục, hoặc dùng 'git credential-manager github logout' của GCM.",
    "P2: Cho chọn tài khoản cần xoá thay vì xoá hết."
  ]
}
