{
  "$schema": "../../hub/schema/tool.schema.json",
  "id": "health-report",
  "name": "Báo cáo sức khoẻ máy (ra Desktop)",
  "version": "1.0",
  "category": "chan-doan",
  "icon": "heart-pulse",
  "audience": "all",
  "summary": "Kiểm tra nhanh CPU, RAM, ổ đĩa, SMART, nhật ký lỗi, màn hình xanh, driver, chkdsk /scan, sfc /verifyonly và ghi tất cả ra một file .txt trên Desktop.",
  "tags": ["chẩn đoán", "sức khoẻ", "báo cáo", "SMART", "sfc", "chkdsk", "event log"],
  "actions": [
    {
      "id": "chay",
      "label": "Tạo báo cáo sức khoẻ",
      "file": "check_health_to_desktop_fixed.bat",
      "type": "console",
      "admin": true,
      "selfElevates": true,
      "risk": "read-only",
      "primary": true,
      "duration": "5-20 phút (sfc /verifyonly và chkdsk /scan lâu nhất)",
      "description": "12 mục kiểm tra, chỉ đọc. Kết quả: health_report_<máy>_<giờ>.txt trên Desktop của tài khoản chạy."
    }
  ],
  "outputs": [
    { "label": "Báo cáo sức khoẻ", "dir": "{Desktop}", "glob": "health_report_%COMPUTERNAME%_*.txt" }
  ],
  "issues": [
    "Trùng phần lớn với CheckWinFix > Thu thập thông tin nhưng ít cảnh báo tự động hơn; phần kết luận vẫn bảo gửi file cho ChatGPT.",
    "Không có sự kiện nào thì in '[LOI] No events were found', dễ hiểu nhầm là lỗi.",
    "Tự nâng quyền bằng đường dẫn đặt trong dấu nháy đơn: thư mục có dấu ' làm hỏng lệnh."
  ],
  "upgrades": [
    "P1: Gộp vào CheckWinFix (Thu thập thông tin đã có các mục này), hoặc giữ làm bản 'nhanh' dùng chung lõi.",
    "P2: Bỏ chkdsk /scan khỏi lần chạy mặc định (chậm), chỉ chạy khi chọn."
  ]
}
